微博id,微博正文,头条文章url,原始图片url,微博视频url,发布位置,发布时间,发布工具,点赞数,转发数,评论数
IwDg9ze2H,交通运输部：全面暂停离汉、离鄂的网约车、顺风车业务           交通运输部今日发布《关于严格落实网约车、顺风车疫情防控管理有关要求的通知》，通知要求：全面暂停离汉、离鄂的网约车、顺风车业务。各平台公司要贯彻落实继续实行严格的离汉离鄂通道管控措施，严格按照湖北省新型冠状病毒感染肺炎疫情防控指挥部相关规定，全面暂停离汉、离鄂的网约车、顺风车业务，坚决防止疫情通过网约车、顺风车从武汉、从湖北输出。 全面暂停进出京跨城网约车、顺风车业务。首都安全稳定直接关系党和国家工作大局。请各平台公司严格按照首都严格进京管理联防联控协调机制相关规定，全面暂停进出京的跨城网约车、顺风车业务，坚决防止疫情通过网约车、顺风车输入北京，全力服务首都疫情防控大局。 来源：央视新闻 ,,无,无,无,2020-03-01 21:06,专业版微博,3,2,0
IwDfpptJu,下周天气云系变化为主，早晚寒凉在阴雨天气中送别二月，迎来三月。今天白天我市天空依旧比较阴沉，时不时有细雨飘落，体感不是太舒适。不过，从明天开始，这样的“坏”天气暂时会消停几天。根据市气象台最新气象资料分析，未来一周我市以云系变化为主，其中6日和8日的夜间各有一次降水过程。具体预报如下：2日多云，3日多云到阴，4日多云，5日晴到多云，6日多云转阴有小雨，7日阴转多云，8日多云转阴有雨。风力方面，下周风向多变，风力一般为陆上3-4级、沿江江面4-6级、沿海海面5-7级。其中，6日受入海高压后部的影响，最大风力可达陆上4-6级、沿江江面和沿海海面6-7级。气温方面，下周平均气温9℃左右，偏高；最高气温15℃左右，出现在7日白天，最低气温3℃左右，出现在3日早晨。【未来三天天气预报】2日：阴转多云，北到东北风4级左右，气温5℃～11℃;3日：多云到阴，偏东风3-4级，气温3℃～11℃;4日：多云，东北风4级左右，气温5℃～11℃。(合作单位：南通市气象局)来源：南通发布（记者 俞慧娟） ,,无,无,无,2020-03-01 21:05,专业版微博,1,0,0
IwDeUpgQD,南通警方大清查！ 办理不按规定登记承租人信息案件32起2月28日9时至3月1日9时，全市公安机关治安系统和派出所集中开展专项清查行动，共出动警力5000余人，共采集登记流动人口3.2万余人，办理不按规定登记承租人信息案件32起。当前，疫情防控处在最吃劲的关键阶段。2月27日，市公安局决定在全市范围内开展以流动人口为重点的专项清查行动，持续抓好社区防控，深入开展流动人口排查登记，核清涉疫人员底数，严格落实小区和重点行业、单位疫情防控措施，为夺取疫情防控工作全胜奠定扎实基础。2月28日上午开始，全市公安机关组织民警、辅警围绕出租房屋特别是群租房、中小旅馆、网约房等流动人口落脚点，以及火车站、机场、长途汽车站、渡口码头等人员易聚集场所，登记核查流动人口，严格落实管理防控措施，持续抓好小区封闭管理、实有人口管理、行业场所巡查等面上管控工作，严防人员聚集、风险输入，同时深入民爆物品、剧毒和易制爆危险化学品等危险物品生产、储存、运输行业，寄递物流行业，以及运送防疫物资、为复工复产企业提供出行服务的交通运输行业，指导、督促责任单位整改安全风险隐患。据统计，在为期两天的行动中，公安机关新采集登记流动人口32908人，核查注销16137人，核实修改7937人，办理不按规定登记承租人信息案件32起，未发现违规开业经营现象。　“把流动人口登记核查作为清查的重中之重。”市公安局副局长杜松华说，随着企业复工复产加快推进，交通查控措施的撤除，交通运输秩序逐步恢复，社会及社区防控工作面临的压力不断加大，社区作为疫情防控主阵地的作用也更加凸显。接下来，公安机关还将持续开展专项清查行动，最大限度减少流动人口返程带来的风险隐患，跟进防控措施，同时通过清查查找发现工作中的薄弱环节，部署强化易发案部位、场所和时段的巡防力度，配合春季破案会战，压降各类刑事案件回潮。来源：南通发布（文丨记者 张亮 通讯员 苏锦安） ,,无,无,无,2020-03-01 21:03,专业版微博,4,0,0
IwBI8wYU0,【#夺取双胜利 我们在行动# | 复工复产，江苏聚力向前】当前，新冠肺炎疫情防控工作到了关键阶段，全国各地科学防治、精准施策、分区分级做好防控，打出政策“组合拳”，在确保安全的前提下积极支持和推动各类企业复工复产，力争如期实现全年目标任务。时不我待，随着全国各地陆续进入“复工进行时”，江苏各地也在持续发力。江苏企业复工情况全国领先，政企同心、多方努力、聚力向前，蹄疾步稳推进经济发展。今天，我们聚焦南通和连云港的复工情况→ http://t.cn/A67JGWiH  #复工复产进行时# 原图 ,,http://wx1.sinaimg.cn/large/b9259e9agy1gcejj3mdq5j20hs0vkadx.jpg,无,无,2020-03-01 17:10,HUAWEI P20 Pro,3,1,6
Iwz7A1JAU,关于新冠肺炎的最新判断，一图读懂→来源：央视新闻  原图 ,,http://wx3.sinaimg.cn/large/b9259e9agy1gce83hqxlvj20u03u9wu5.jpg,无,无,2020-03-01 10:34,专业版微博,4,6,0
Iwz0o7rzs,南通市新型冠状病毒肺炎疫情通报（3.1）2020年2月29日0-24时，我市无新增新型冠状病毒肺炎确诊病例。截至2月29日24时，我市累计报告新型冠状病毒肺炎确诊病例40例，其中，普通型病例40例，出院病例37例。确诊病例中，海安市5例（高新区3例、其中出院3例，南莫镇2例、其中出院1例），如皋市7例（长江镇3例、其中出院3例，如城街道3例、其中出院3例，江安镇1例、其中出院1例），如东县3例（栟茶镇3例，其中出院3例），海门市14例（悦来镇2例、其中出院2例，高新区2例、其中出院2例，三厂街道5例、其中出院4例，滨江街道1例、其中出院1例， 海门港新区1例、其中出院1例，开发区2例、其中出院2例，三星镇1例、其中出院1例），启东市3例（吕四港镇2例、其中出院2例，王鲍镇1例、其中出院1例），通州区8例（平潮镇3例、其中出院3例，张芝山镇4例、其中出院3例，金新街道1例、其中出院1例）。目前，共追踪密切接触者1318人，已解除医学观察1301人，尚有17人正在接受医学观察。南通市新型冠状病毒感染的肺炎疫情防控指挥部 2020年3月1日 ,,无,无,无,2020-03-01 10:17,专业版微博,8,4,3
IwywyFbnG,关于仲崇俊等同志任职的通知为支持湖北坚决打赢新冠肺炎疫情阻击战，根据中央统一安排部署，江苏省选派了第二批医疗专家团队对口支援大冶市新冠肺炎疫情防控工作。根据工作需要，经研究决定：仲崇俊同志（南通市第一人民医院党委书记、副院长）挂任大冶市新冠肺炎疫情防控指挥部副指挥长、大冶市人民医院党委第一书记；刘春慧同志（女，南通市第一人民医院护理部副主任）挂任市人民医院护理办公室副主任；严红燕同志（女，南通市第一人民医院神经外科护士长）挂任市人民医院感染管理办公室副主任。中共大冶市委2020年2月29日来源：大冶市融媒体中心  大冶发布 原图 ,,http://wx2.sinaimg.cn/large/b9259e9agy1gce5gcynswj20kk0aemy6.jpg,无,无,2020-03-01 09:03,专业版微博,11,0,7
IwyokmwPh,2月29日江苏无新增新型冠状病毒肺炎确诊病例来源：健康江苏2020年2月29日0-24时，江苏省无新增新型冠状病毒肺炎确诊病例。新增出院病例10例。截至2月29日24时，江苏省累计报告新型冠状病毒肺炎确诊病例631例。其中，南京市93例、无锡市55例、徐州市79例、常州市51例、苏州市87例、南通市40例、连云港市48例、淮安市66例、盐城市27例、扬州市23例、镇江市12例、泰州市37例、宿迁市13例。累计确诊病例中，在院病例102例。其中，轻型病例9例；普通型病例90例；重型病例1例（南京市1例）；危重型病例2例（无锡市1例、连云港市1例）。出院病例529例。其中，南京市58例、无锡市49例、徐州市71例、常州市48例、苏州市64例、南通市37例、连云港市37例、淮安市55例、盐城市27例、扬州市23例、镇江市11例、泰州市37例、宿迁市12例。目前，江苏省追踪到密切接触者12633人，已解除医学观察12503人，尚有130人正在接受医学观察。专家提醒：当前疫情形势依然严峻复杂。随着我省响应级别调整，各项限制性措施逐步解除，人群流动将逐渐恢复常态，暴露于传染源的机会大大增加，公众仍须注意加强自我防护。要继续保持防范意识，减少社会交流活动，减少不必要的人群聚集；家庭及办公场所要勤通风；出行时佩戴口罩，尤其是去往人群密集的公共场所时；要勤洗手，注意饮食卫生，养成健康的生活方式。 ,,无,无,无,2020-03-01 08:43,专业版微博,7,1,2
Iwy9Tht9T,截至2月29日24时新型冠状病毒肺炎疫情最新情况来源：国家卫生健康委员会官网2月29日0—24时，31个省（自治区、直辖市）和新疆生产建设兵团报告新增确诊病例573例，新增死亡病例35例（湖北34例，河南1例），新增疑似病例132例。当日新增治愈出院病例2623例，解除医学观察的密切接触者8620人，重症病例减少299例。截至2月29日24时，据31个省（自治区、直辖市）和新疆生产建设兵团报告，现有确诊病例35329例（其中重症病例7365例），累计治愈出院病例41625例，累计死亡病例2870例，累计报告确诊病例79824例，现有疑似病例851例。累计追踪到密切接触者660716人，尚在医学观察的密切接触者51856人。湖北新增确诊病例570例（武汉565例），新增治愈出院病例2292例（武汉1675例），新增死亡病例34例（武汉26例），现有确诊病例32959例（武汉27700例），其中重症病例7107例（武汉6393例）。累计治愈出院病例31187例（武汉19227例），累计死亡病例2761例（武汉2195例），累计确诊病例66907例（武汉49122例）。新增疑似病例64例（武汉50例），现有疑似病例646例（武汉393例）。累计收到港澳台地区通报确诊病例144例：香港特别行政区95例（出院33例，死亡2例），澳门特别行政区10例（出院8例），台湾地区39例(出院9例，死亡1例)。 ,,无,无,无,2020-03-01 08:07,专业版微博,3,0,0
Iwy7c4QVi,大中小学啥时开学？患者治愈后，做啥康复治疗？权威回应来了！来源：中国政府网  [组图共2张] 原图 ,,"http://ww3.sinaimg.cn/large/b9259e9agy1gce3nkxvb5j20hs0f9jsi.jpg,http://ww2.sinaimg.cn/large/b9259e9agy1gce3nleaonj20hs7dqhdl.jpg",无,无,2020-03-01 08:01,专业版微博,3,2,1
IwxUkbMCw,崇川区关于对在疫情防控阻击战中表现突出的人员给予表扬（晋级）的通报（四）新冠肺炎疫情防控阻击战打响以来，全区广大基层党组织和党员干部按照区委、区政府关于疫情防控工作的部署要求，把疫情防控作为当前最重要的工作来抓，全面动员、众志成城、拼搏奋战，勇于克服各种困难，积极投身防控一线，用最美“逆行”向疫情宣战，充分发挥了基层党组织的战斗堡垒作用和党员干部的先锋模范作用。近期，全区广大基层党组织和党员干部更加精准地把握疫情发展的特点，一手抓疫情防控、一手抓复工复产，以有效的疫情防控为复工复产创造条件，以积极的恢复生产为疫情防控提供保障，涌现出了一批信念坚定、冲锋在前、担当作为、甘于奉献的先进典型。为了激励先进、鼓舞斗志，对照《崇川区疫情防控战时党员干部六条激励措施》，通过一线了解和专项考察，经研究，对以下10名人员给予通报表扬（晋级）：薛  平，区卫健委主任、党组书记，推荐晋升一级主任科员孙  彬，文峰街道城管执法中队队长、四级主办，推荐进一步使用陈  勇，观音山街道盘香沟社区党委书记，由A3档晋升到A2档李玉琪，狼山镇街道三角桥社区社工，由B2档晋升到B1档马  达，区新闻中心工作人员，由C2档晋升到C1档冯  艳，和平桥街道濠西社区社工，由C2档晋升到C1档钱  伟，新城桥街道朝晖社区社工，由C3档晋升到C2档汤云飞，区发改委办公室主任，优先推荐为先进个人王世娟，区市场监督管理局城东分局科员，由党员发展对象优先吸收入党尤志等，观音山派出所治安民警，由入党积极分子优先确定为党员发展对象全区各级党组织和广大党员干部要进一步提高站位、振奋精神、凝聚力量、持续奋战，把党的政治优势、组织优势、密切联系群众优势转化为疫情防控工作优势，始终把人民群众生命安全和身体健康放在第一位，坚决做好各项防控工作，让党旗在防控疫情斗争第一线高高飘扬，为打赢疫情防控阻击战作出应有的贡献！中共南通市崇川区委组织部南通市崇川区人力资源和社会保障局2020年2月29日 ,,无,无,无,2020-03-01 07:29,专业版微博,2,0,1
IwxRCCoFB,中国-世卫组织联合考察报告发布！10条干货必看来源：健康中国29日，国家卫生健康委发布《中国-世界卫生组织新型冠状病毒肺炎（COVID-19）联合考察报告》，公布了对新冠肺炎的最新研究结果与应对措施。报告指出，中国采取了历史上最勇敢、最灵活、最积极的防控措施。1.病毒属性：新冠病毒是一种动物源性病毒；在武汉发现的早期病例被认为是通过动物传染到人的途径感染，截至2月25日，尚未查明动物来源。2.病毒宿主：蝙蝠似乎是该病毒的宿主，但中间宿主尚未查明。3.病毒特点：新型冠状病毒是一种新出现的病原体，传染性强、传播速度快。它既不是SARS，也不是流感。4.传播途径：新冠肺炎在无防护下通过飞沫和密切接触在感染者和被感染者之间发生传播，在医疗机构中或可存在因医疗操作产生气溶胶而发生空气传播的可能，粪-口传播似乎并不是主要传播方式。5.传播来源：到目前为止，绝大多数病例是来自武汉或湖北或与之有直接联系。社区传播非常有限，人际传播主要在家庭中发生。6.易感人群：新冠肺炎病毒几乎人人易感，感染后是否具有免疫力需进一步研究；真正的无症状感染者比例尚不明确，但相对较罕见，也不是传播的主要驱动因素。7.患者特征：新冠肺炎患者通常在感染后平均5至6天（平均潜伏期5至6天，范围1至14天）出现轻度呼吸道症状和发热等症状，多数患者为轻症可痊愈，重症和死亡高危人群为年龄60岁以上。8.医务人员感染：流调显示，许多医务人员病例可能是在家庭内而非医院感染的。湖北以外地区的医务人员感染很少见。医疗机构医务人员感染并不是新冠肺炎在中国的主要传播特征。9.中国措施：中国采取了坚定有力的综合性非药物性干预措施，非常有效地切断病毒传播途径，为全球应对新冠肺炎提供了重要经验。这些措施包括：开展积极主动监测，迅速发现并立即诊断、隔离病例，严格追踪并隔离密切接触者，引导民众理解并接受上述措施。10.公众建议：认识到新冠肺炎是一种全新出现的令人关注的传染性疾病，但只要采取正确的应对措施，疫情暴发就可以得到控制，患者大都能够康复；立即采取并落实最为严格的预防措施，勤洗手，打喷嚏或咳嗽时掩住口鼻；时时关注新冠肺炎及其体征和症状（如发热、干咳）的最新信息，不断调整应对策略；人人做好准备，通过各种方式积极参与到疫情防控中来，严格保持“社交距离”，努力帮助老年人等高危人群。 ,,无,无,无,2020-03-01 07:22,专业版微博,3,0,0
IwxOryxzv,狼山国家森林公园今天开园！关于景区开放的公告尊敬的市民、游客：根据当前省、市新型肺炎疫情防控形势和逐步恢复生活秩序的有关要求，经相关部门审核，狼山国家森林公园符合开园条件。现决定自3月1日起，有序开放狼山国家森林公园部分景区，通告如下：一、开放范围1、自2020年3月1日起，有序开放狼山、啬园、军山景区室外区域，室内区域（广教寺、圣严法师纪念馆、军山普陀别院、啬园张氏飨堂等）、狼山山道和商铺暂不开放。2、狼山景区仅开放北门，啬园仅开放北门。二、开放时间：8：30—16：00三、人流控制当天入园游客密度进行实时监控，日最高承载量不超过核定值的50%，并根据实时情况对在园人数做适当调整。四、门票政策各景区入园门票价格以现场公示为准，全国医护工作者（凭本人有效证件）免票入园。五、注意事项1、所有进入景区人员须佩戴口罩，携带居民身份证或电子通行证等有效证件，并配合景区工作人员做好体温测量和实名登记，体温异常人员，谢绝入园，并按相关流程处置。2、营业期间暂不提供导游、索道、电瓶车及年卡办理等服务。3、景区窗口购票、检票排队请自觉保持1米以上距离；景区提供线上实名购票、自助购票、现场扫码支付等非接触式入园服务。4、在疫情全面解除前，景区内不得开展任何聚集性活动，一经发现，工作人员将予以劝阻。请广大游客、市民积极配合，共同努力，营造一个卫生、安全、有序的游览环境。应急电话：狼山景区：85705215啬园景区：85705301军山景区：85703117市第三人民医院（发热门诊）：18934523287狼山镇街道：85718288狼山派出所：18860979555南通狼山旅游度假区2020年2月29日 [组图共2张] 原图 ,,"http://ww4.sinaimg.cn/large/b9259e9agy1gce2bjbf8ej20k00b9n07.jpg,http://ww1.sinaimg.cn/large/b9259e9agy1gce2bjdel6j20k00b9te6.jpg",无,无,2020-03-01 07:14,专业版微博,4,1,0
IwsxdDaY7,机动车检验标志电子化等新措施，明起在江苏试点实施2020年1月，公安部推出6项交管改革便民利企新措施，包括机动车检验标志电子化、接受教育减免交通违法记分、提供交通事故处理进度和结果网上查询3项试点的新措施，以及租赁车交通违法处理简捷快办、小客车转籍信息网上转递、交通安全导航提示服务3项全面推行的改革措施。据省公安厅交警总队相关负责人介绍，3月1日起，3项试点的新措施将如期实施。其中，机动车检验标志电子化在我省南京市试点，提供交通事故处理进度和结果网上查询则在全省范围试点。同时，我省张家港市正在开展参加交通安全公益活动减免记分的试点工作。试点机动车检验标志电子化，进一步推进减证便民。实行机动车检验标志电子化，通过全国统一的互联网交通安全综合服务平台核发检验标志电子凭证，减少纸质证明标志，免去群众粘贴麻烦。办理车辆登记、检验业务时，信息系统将自动推送检验标志电子凭证，群众可登录互联网交通安全综合服务平台或者“交管12123”手机APP，直接查看、下载使用。对6年内的免检车辆，可以直接在网上申领检验标志电子凭证；对检验有效期内的在用车辆，可以直接上网下载使用。已领取检验标志电子凭证的车辆，不需要再粘贴纸质标志，交通民警在执法管理中将通过警务执法终端等方式核查车辆检验状况。同时，鼓励相关行业部门在保险理赔、车辆租赁交易等领域广泛应用检验标志电子凭证，便利群众、企业办事。3月1日起，北京、天津、上海、重庆、哈尔滨、南京、杭州、宁波、济南、株洲、深圳、海口、成都、贵阳、玉溪、乌鲁木齐16个城市第一批试点机动车检验标志电子化，在试点基础上，将加快全国推广应用。试点提供交通事故处理进度和结果网上查询，进一步保证公开透明。对造成人员伤亡或者较大财产损失、适用一般程序处理的交通事故，事故各方当事人及其代理人可以通过互联网交通安全综合服务平台、“交管12123”手机APP查询事故处理进度、结果。其中，事故处理进度包括案件受理、扣留扣押、调查取证、检验鉴定、损害赔偿调解等内容；事故处理结果包括道路交通事故认定书、交通事故证明、复核结论等内容。此外，事故车辆所有人、事故车辆承保保险公司人员提出申请的，也可以上网查询。3月1日起，上海、江苏、山东、广东、重庆、四川6个省（市）先行试点，2020年底前将在全国全面实施。另外，租赁车交通违法处理简捷快办、小客车转籍信息网上转递、交通安全导航提示服务3项改革措施，已在我省试点落实，将于3月底前在全国全面实施，进一步扩大改革覆盖面，让更多群众企业享受到便利实惠。 原图 ,,http://wx2.sinaimg.cn/large/b9259e9agy1gcdf3sstxuj20u099me85.jpg,无,无,2020-02-29 17:48,360安全浏览器,6,2,1
Iwst8rDtk,南通发布原创视频：他们在为你“加油”来源：南通发布（记者申雯）△视频作者朱昊晨申雯“疫”线有你，今天要说的是一群飞机加油员!也许你会好奇，飞机加油员，跟“疫”线的距离似乎有点远，其实并不然。南通兴东国际机场所有起降航班的加油保障都由中国航油南通供应站负责。疫情期间，加油员们更要保证高质量完成各项航班加注任务，确保空中救援绿色通道万无一失，因为这里面就包括运输防疫物资的航班、疑似高烧人员所在的航班，加油员们也时刻面临着暴露的风险。中国航油南通供应站里是一群清一色的汉子，最小的1997年出生，他们都是与经停南通的飞机最亲密的人。因为适应航班的需要，平时他们都是轮流做一休一，但在这次疫情期间，他们却谁都不愿意休息。在江苏启动突发公共卫生事件一级响应之前，经理芦承志就敏锐觉察到了局势可能会发生变化，提出划分保障组、后备组和应急组的方案，成员们争先恐后报名参加保障组，虽然大家都知道，这就意味着直至疫情结束，只要没有特殊情况保障组成员将绝不下线。连续30多天，芦承志、胡建军、余雪峰、张鸿、王颖、孙煜这六个汉子舍小家保大家，这里面有刚刚热恋的小情侣、有家有萌宝的女儿奴、有担心孩子学业的父亲……但是他们共同的身份是保障者。他们曾亲眼看到游客从泰国人肉背回防护物资，心生感动;他们在等待保障发烧乘客所在航班时，也会心有所惧，但他们始终牢记坚持高质量完成各项航班加注任务，确保万无一失的使命，因为“疫”线需要你，需要我，需要他!这群可爱的人还联合自己的名字起了个组名，叫“志煜”组，以此向所有医护人员致敬：你们负责“治愈”，他们为你“加油”! http://t.cn/A67VWyMR ,,无,无,无,2020-02-29 17:38,微博视频号,5,1,0
IwssZfUh7,南通开发区举办春季首场现场招聘会，45家企业提供逾千优质岗位为有效缓解复工企业用工短缺，保障生产和经济发展，同时积极为返乡、来通的各类人员搭建选岗求职平台，2月29日上午，南通开发区在严格做好疫情防控的情况下，在区人力资源服务中心举办2020年春季首场现场招聘会。为严格遵守疫情期间防控要求，此次招聘会所有工作人员和求职者都要凭身份证从指定入口进入，自觉接受体温测量，并登记身份信息，填写疫情防控承诺书。15天内有重点疫区（含一般重点疫区）旅居史、接触史的以及发热人员，不得进入场内，可领取纸质岗位招聘信息以非现场形式求职。应聘摊位前等待洽谈时，有序排队并保持1.5米以上距离。本次招聘会还控制了入场企业和求职者数量入场人员达到一定数量时，将控制人员分批进入。据悉，这次招聘会仅开放45个招聘摊位，45家规模企业参会，将提供1000余个优质岗位。来源：南通发布（文/记者 陈可 通讯员 钱咸华 图/通讯员 钱咸华） [组图共4张] 原图 ,,"http://ww3.sinaimg.cn/large/b9259e9agy1gcdepvey1oj20v90jo44u.jpg,http://ww4.sinaimg.cn/large/b9259e9agy1gcdepvhz3vj20v30juags.jpg,http://ww3.sinaimg.cn/large/b9259e9agy1gcdepvl84mj20v30jq7af.jpg,http://ww4.sinaimg.cn/large/b9259e9agy1gcdepvgfyij20v60jrgrh.jpg",无,无,2020-02-29 17:38,专业版微博,0,0,1
